<?xml version="1.0" encoding="utf-8"?>
<!DOCTYPE dataset SYSTEM "../sipxconfig-db.dtd">
	
<dataset>
  <value_storage value_storage_id="4000"/>
  <value_storage value_storage_id="4001"/>
  
  <setting_value value_storage_id="4000" path="acd-line/extension" value="1111"/>
  <setting_value value_storage_id="4001" path="acd-line/extension" value="2222"/>

  <location location_id="101" name="localhost" fqdn="localhost" ip_address="127.0.0.1" primary_location="true"/>
  <acd_server acd_server_id="1001" location_id="101" port="8100"/>
  <acd_line acd_line_id="2001" name="l2" acd_server_id="1001" value_storage_id="4000"/>
  <acd_line acd_line_id="2002" name="l2" acd_server_id="1001" value_storage_id="4001"/>  
</dataset>
